{
  "$schema": "./数据模式/阶段进程矩阵第二版模式.json",
  "matrixVersion": 2,
  "authority": "normative",
  "phases": [
    {
      "id": "E0",
      "capabilities": [
        "extension-manager",
        "one-client-one-host-process",
        "launch-capability",
        "local-capability-broker",
        "disposable-package-verifier",
        "package-and-permission-validation"
      ],
      "distributionBoundary": "internal-fixtures-only"
    },
    {
      "id": "E1",
      "capabilities": [
        "themes",
        "read-only-diagnostics",
        "developer-mode",
        "local-self-signed-trust-store"
      ],
      "distributionBoundary": "offline-accountless-low-privilege"
    },
    {
      "id": "E2",
      "capabilities": [
        "editing-commands",
        "fenced-block-syntax",
        "block-directive-syntax",
        "single-document-export",
        "declarative-sidebar",
        "declarative-extension-content-tree",
        "official-wasm-content-engine-prototype"
      ],
      "distributionBoundary": "locally-signed-or-reviewed-no-network"
    },
    {
      "id": "E3",
      "capabilities": [
        "curated-free-marketplace",
        "fixed-origin-market-broker",
        "signed-pack-release-record",
        "double-signing",
        "transparency-log",
        "terminal-revocation"
      ],
      "distributionBoundary": "official-or-invite-only"
    },
    {
      "id": "E4",
      "capabilities": [
        "official-typed-connectors",
        "network-credential-broker",
        "core-owned-sync-plaintext",
        "official-ai-companion",
        "immutable-model-store",
        "typed-network-adapters",
        "global-ai-cost-ledger"
      ],
      "distributionBoundary": "high-trust-manual-review"
    },
    {
      "id": "E5",
      "capabilities": [
        "general-network-service-policy",
        "third-party-ai-provider-and-tool",
        "paid-and-enterprise-marketplace"
      ],
      "distributionBoundary": "after-full-ssrf-and-market-governance"
    }
  ],
  "targets": [
    {
      "id": "main-app",
      "displayName": "Inflow Main App",
      "introducedIn": "CORE",
      "instanceModel": "singleton",
      "plaintext": "document-and-core-owned-approved-data",
      "fileAccess": ["user-scoped-documents", "core-owned-encrypted-stores"],
      "network": "none",
      "keychainPolicyRefs": [
        "recovery-kek",
        "workspace-index-kek",
        "sync-kek",
        "ai-session-kek",
        "extension-state-kek"
      ],
      "responsibilities": ["ui", "document-model", "save-recovery", "workspace-index-store-owner", "typed-tree", "sync-store-owner", "ai-response-owner"]
    },
    {
      "id": "extension-manager",
      "displayName": "ExtensionManager.xpc",
      "introducedIn": "E0",
      "instanceModel": "singleton-on-demand",
      "plaintext": "none",
      "fileAccess": ["extension-install-directory", "private-verification-staging"],
      "network": "none",
      "keychainPolicyRefs": ["extension-trust-key"],
      "responsibilities": ["installation-transaction", "signature-policy", "dedicated-host-client-lifecycle", "revocation-state"]
    },
    {
      "id": "package-verifier",
      "displayName": "PackageVerifier.xpc",
      "introducedIn": "E0",
      "instanceModel": "one-process-per-verification-job",
      "plaintext": "untrusted-package-bytes-only",
      "fileAccess": ["read-only-source-fd", "job-private-noexec-cas"],
      "network": "none",
      "keychainPolicyRefs": [],
      "responsibilities": ["zip-json-css-font-svg-parsing", "content-hashing", "static-scanning", "verification-receipt"],
      "mustNotAccess": ["extension-install-directory", "trust-store", "keychain", "user-documents"]
    },
    {
      "id": "local-capability-broker",
      "displayName": "LocalCapabilityBroker.xpc",
      "introducedIn": "E0",
      "instanceModel": "singleton-on-demand",
      "plaintext": "approved-fragments-or-opaque-handles-only",
      "fileAccess": ["broker-issued-restricted-fds"],
      "network": "none",
      "keychainPolicyRefs": [],
      "responsibilities": ["peer-authentication", "permission-checks", "document-transactions", "fd-brokering"]
    },
    {
      "id": "extension-host",
      "displayName": "ExtensionHost.xpc",
      "introducedIn": "E0",
      "instanceModel": "one-process-per-authenticated-client",
      "plaintext": "low-privilege-snapshot-only",
      "fileAccess": [],
      "network": "none",
      "keychainPolicyRefs": [],
      "responsibilities": ["javascriptcore-or-approved-wasm-compute"],
      "runtimeEvidence": ["one-dedicated-extension-host-launcher-client-per-extension-handle", "distinct-pid-and-audit-token-per-active-extension", "reject-second-extension-binding"]
    },
    {
      "id": "market-broker",
      "displayName": "MarketBroker.xpc",
      "introducedIn": "E3",
      "instanceModel": "singleton-on-demand",
      "plaintext": "signed-catalog-and-package-streams-only",
      "fileAccess": [],
      "network": "fixed-market-origins-only",
      "keychainPolicyRefs": [],
      "responsibilities": ["catalog", "release-records", "revocations", "quarantine-download-stream"]
    },
    {
      "id": "network-credential-broker",
      "displayName": "NetworkCredentialBroker.xpc",
      "introducedIn": "E4",
      "instanceModel": "singleton-on-demand",
      "plaintext": "bounded-approved-one-shot-streams-only",
      "fileAccess": [],
      "network": "typed-adapter-policy-only",
      "keychainPolicyRefs": ["network-service-credentials"],
      "responsibilities": ["typed-adapter-http", "credential-application", "upload-and-response-streaming"],
      "mustNotAccess": ["sync-pending-store", "ai-session-store", "user-documents"]
    },
    {
      "id": "ai-model-manager",
      "displayName": "AI Model Manager",
      "introducedIn": "E4",
      "instanceModel": "singleton-on-demand",
      "plaintext": "none",
      "fileAccess": ["model-download-staging"],
      "network": "signed-model-catalog-policy-only",
      "keychainPolicyRefs": ["model-source-credentials"],
      "responsibilities": ["model-download", "signature-and-license-metadata", "publish-request"]
    },
    {
      "id": "ai-model-store",
      "displayName": "AIModelStore.xpc",
      "introducedIn": "E4",
      "instanceModel": "singleton-on-demand",
      "plaintext": "none",
      "fileAccess": ["versioned-immutable-model-cas"],
      "network": "none",
      "keychainPolicyRefs": [],
      "responsibilities": ["independent-rehash", "immutable-publication", "model-fd-leases", "reference-counted-gc"]
    },
    {
      "id": "ai-inference-worker",
      "displayName": "AI Inference Worker",
      "introducedIn": "E4",
      "instanceModel": "one-process-per-active-request",
      "plaintext": "approved-context-envelope-and-generated-token-stream",
      "fileAccess": ["leased-read-only-model-fds"],
      "network": "none",
      "keychainPolicyRefs": [],
      "responsibilities": ["local-inference-only"]
    },
    {
      "id": "render-image-helpers",
      "displayName": "Render/Image helpers",
      "introducedIn": "CORE",
      "instanceModel": "one-process-per-job",
      "plaintext": "single-job-content",
      "fileAccess": ["leased-read-only-fds"],
      "network": "none",
      "keychainPolicyRefs": [],
      "responsibilities": ["disposable-render-or-decode"]
    },
    {
      "id": "pdf-postflight-helper",
      "displayName": "PDFPostflightHelper.xpc",
      "introducedIn": "CORE",
      "instanceModel": "one-process-per-pdf-job",
      "plaintext": "single-candidate-pdf-only",
      "fileAccess": ["job-private-unlinked-fd"],
      "network": "none",
      "keychainPolicyRefs": [],
      "responsibilities": ["pdf-parse-strip-allowlist-rebuild-and-independent-second-pass"],
      "mustNotAccess": ["user-paths", "security-bookmarks", "keychain", "default-printer", "print-spool"]
    }
  ],
  "ciInvariants": [
    "actual-targets-signatures-entitlements-and-ipc-edges-match-authority",
    "network-entitlement-exists-only-on-declared-network-targets",
    "keychain-access-groups-match-keychain-policy",
    "n-active-extension-handles-produce-n-distinct-host-pids-and-audit-tokens",
    "package-verifier-is-disposable-and-cannot-write-install-or-trust-stores",
    "pdf-postflight-helper-is-disposable-networkless-keyless-and-has-no-print-or-user-path-access"
  ]
}
